<?xml version="1.0" encoding="utf-8"?>
<!DOCTYPE module SYSTEM "module.dtd">
<module>
  <function returnType="array" name="hash_algos" description="Return a list of registered hashing algorithms." />
  <function returnType="string" name="hash_file" description="Generate a hash value using the contents of a given file.">
    <param type="string" name="algo" />
    <param type="string" name="filename" />
    <param optional="true" type="bool" name="raw_output" />
  </function>
  <function returnType="string" name="hash_final" description="Finalize an incremental hash and return resulting digest.">
    <param type="resource" name="context" />
    <param optional="true" type="bool" name="raw_output" />
  </function>
  <function returnType="string" name="hash_hmac_file" description="Generate a keyed hash value using the HMAC method and the contents of a given file.">
    <param type="string" name="algo" />
    <param type="string" name="filename" />
    <param type="string" name="key" />
    <param optional="true" type="bool" name="raw_output" />
  </function>
  <function returnType="string" name="hash_hmac" description="Generate a keyed hash value using the HMAC method.">
    <param type="string" name="algo" />
    <param type="string" name="data" />
    <param type="string" name="key" />
    <param optional="true" type="bool" name="raw_output" />
  </function>
  <function returnType="resource" name="hash_init" description="Initialize an incremental hashing context.">
    <param type="string" name="algo" />
    <param optional="true" type="int" name="options" />
    <param optional="true" type="string" name="key" />
  </function>
  <function returnType="bool" name="hash_update_file" description="Pump data into an active hashing context from a file.">
    <param type="resource" name="context" />
    <param type="string" name="filename" />
    <param optional="true" type="resource" name="context" />
  </function>
  <function returnType="int" name="hash_update_stream" description="Pump data into an active hashing context from an open stream.">
    <param type="resource" name="context" />
    <param type="resource" name="handle" />
    <param optional="true" type="int" name="length" />
  </function>
  <function returnType="bool" name="hash_update" description="Pump data into an active hashing context.">
    <param type="resource" name="context" />
    <param type="string" name="data" />
  </function>
  <function returnType="string" name="hash" description="Generate a hash value (message digest).">
    <param type="string" name="algo" />
    <param type="string" name="data" />
    <param optional="true" type="bool" name="raw_output" />
  </function>
</module>
