<?xml version="1.0" encoding="utf-8"?>
<!DOCTYPE module SYSTEM "module.dtd">
<module>
  <function returnType="int" name="tidy_access_count" description="Returns the Number of Tidy accessibility warnings encountered for specified document.">
    <param type="object" name="tidy" />
  </function>
  <function returnType="bool" name="tidy_clean_repair" description="Execute configured cleanup and repair operations on parsed markup.">
    <param type="object" name="tidy" />
  </function>
  <function returnType="int" name="tidy_config_count" description="Returns the Number of Tidy configuration errors encountered for specified document.">
    <param type="object" name="tidy" />
  </function>
  <function returnType="bool" name="tidy_diagnose" description="Run configured diagnostics on parsed and repaired markup.">
    <param type="object" name="tidy" />
  </function>
  <function returnType="int" name="tidy_error_count" description="Returns the Number of Tidy errors encountered for specified document.">
    <param type="object" name="tidy" />
  </function>
  <function returnType="object" name="tidy_get_body" description="Returns a tidyNode Object starting from the body tag of the tidy parse tree.">
    <param type="object" name="tidy" />
  </function>
  <function returnType="array" name="tidy_get_config" description="Get current Tidy configuration.">
    <param type="object" name="tidy" />
  </function>
  <function returnType="string" name="tidy_get_error_buffer" description="Return warnings and errors which occurred parsing the specified document.">
    <param type="object" name="tidy" />
  </function>
  <function returnType="object" name="tidy_get_head" description="Returns a tidyNode Object starting from the head tag of the tidy parse tree.">
    <param type="object" name="tidy" />
  </function>
  <function returnType="object" name="tidy_get_html" description="Returns a tidyNode Object starting from the html tag of the tidy parse tree.">
    <param type="object" name="tidy" />
  </function>
  <function returnType="int" name="tidy_get_html_ver" description="Get the Detected HTML version for the specified document.">
    <param type="object" name="tidy" />
  </function>
  <function returnType="mixed" name="tidy_getopt" description="Returns the value of the specified configuration option for the tidy document.">
    <param type="object" name="tidy" />
    <param type="string" name="option" />
  </function>
  <function returnType="string" name="tidy_get_opt_doc" description="Returns the documentation for the given option name.">
    <param type="object" name="tidy" />
    <param type="string" name="optname" />
  </function>
  <function returnType="string" name="tidy_get_output" description="Return a string representing the parsed tidy markup.">
    <param type="object" name="tidy" />
  </function>
  <function returnType="string" name="tidy_get_release" description="Get release date (version) for Tidy library." />
  <function returnType="object" name="tidy_get_root" description="Returns a tidyNode object representing the root of the tidy parse tree.">
    <param type="object" name="tidy" />
  </function>
  <function returnType="int" name="tidy_get_status" description="Get status of specified document.">
    <param type="object" name="tidy" />
  </function>
  <function returnType="bool" name="tidy_is_xhtml" description="Indicates if the document is a XHTML document.">
    <param type="object" name="tidy" />
  </function>
  <function returnType="bool" name="tidy_is_xml" description="Indicates if the document is a generic (non HTML/XHTML) XML document.">
    <param type="object" name="tidy" />
  </function>
  <function returnType="void" name="tidy_load_config" description="Load an ASCII Tidy configuration file with the specified encoding.">
    <param type="string" name="filename" />
    <param type="string" name="encoding" />
  </function>
  <function returnType="object" castToFalse="true" name="tidy_parse_file" description="Parse markup in file or URI.">
    <param type="string" name="filename" />
    <param optional="true" type="mixed" name="config" />
    <param optional="true" type="string" name="encoding" />
    <param optional="true" type="bool" name="use_include_path" />
  </function>
  <function returnType="object" castToFalse="true" name="tidy_parse_string" description="Parse a document stored in a string.">
    <param type="string" name="input" />
    <param optional="true" type="mixed" name="config" />
    <param optional="true" type="string" name="encoding" />
  </function>
  <function returnType="string" name="tidy_repair_file" description="Repair a file and return it as a string.">
    <param type="string" name="filename" />
    <param optional="true" type="mixed" name="config" />
    <param optional="true" type="string" name="encoding" />
    <param optional="true" type="bool" name="use_include_path" />
  </function>
  <function returnType="string" name="tidy_repair_string" description="Repair a string using an optionally provided configuration file.">
    <param type="string" name="data" />
    <param optional="true" type="mixed" name="config" />
    <param optional="true" type="string" name="encoding" />
  </function>
  <function returnType="bool" name="tidy_reset_config" description="Restore Tidy configuration to default values." />
  <function returnType="bool" name="tidy_save_config" description="Save current settings to named file.">
    <param type="string" name="filename" />
  </function>
  <function returnType="bool" name="tidy_set_encoding" description="Set the input/output character encoding for parsing markup.">
    <param type="string" name="encoding" />
  </function>
  <function returnType="bool" name="tidy_setopt" description="Updates the configuration settings for the specified tidy document.">
    <param type="string" name="option" />
    <param type="mixed" name="value" />
  </function>
  <function returnType="int" name="tidy_warning_count" description="Returns the Number of Tidy warnings encountered for specified document.">
    <param type="object" name="tidy" />
  </function>
  <function returnType="string" name="ob_tidyhandler" description="ob_start callback function to repair the buffer.">
    <param type="string" name="input" />
    <param optional="true" type="int" name="mode" />
  </function>
</module>
